{
  "anomaly_samples": {
    "duplicate_links": [],
    "one_to_many_a": [
      "004848d4d9ea16926e4c9dcec43a387e81157f4790b1ca9aa5074011a9390ed8",
      "0075e86558a1ce734e82d8595e53f73c52800b408a4452bdbec9d3c58fa1cce6",
      "00b0546771ff0e967afead19fde1b9420db08df2e8d6d1d81c5300a2c970c99f",
      "00bd2e4a8f02ef57bcfb3e181102f9e379b8b6e065800202b37d465614e50eab",
      "00c126e421cf927e2847e42649d731a42c674b0568427afb9e1d7730b7fa49cb",
      "00cb11e719559c0acc0cbe6f5517149c2e640a85a892590d3ca803e92acab435",
      "00da3a6e8febe686d545ca93750df644b7807b8bd7339ef08b3494c2feff6698",
      "0101ef8e4c743fbdb6395692f1e63ac3f36a15ce296d7836f6284b204eb6bc69",
      "0155da9618e018f57b2b41d9cd7ff4a16c963bc6a7c9be381086aad25a624313",
      "019843ee7ba3cfc6bc7ec27e866281aa990d9524c698ad0c022573dd5081faef",
      "0198c718fccb2acb67153e09ad2db9b3df7f0b2b993ef1461128b6f4b24a1aff",
      "01d6fba2ef32b38c5a416ec591ed362a43fd35ca20f63385010370376c3e5037",
      "020a2b611ea4fdacfa512094b3a8c72c113e2bdefbdcd8afd8a4f8ee10de7f26",
      "0225be82b207b9a0044b0706ac883b70f9929227afacd0f4dcebf5b748744b4b",
      "02bb12af5772c492e9f8520381d4865e57bee5f9b7217fe5e3584a70ce0e8acd",
      "02c49c12e8f4a83682d571d2a80f8160cdd0b42e7f75a93159940abcc1dba64a",
      "02d028a8a4e801e93c021d93418a260d3cbcf32f28896fc29a602886542bfdf8",
      "03295cec7ff40f53ddbadf83d6fdb80da58653588a98ef0e509a3f63d2af2607",
      "03c68ad63ce863beec6a71f864c70ceda56caded8c019e70bbe2a9d6b9e0c1cd",
      "03d2cceba2dfb72e647818d0b1b5f6ddb4ff6378b7161be6335c5b7dc0513cce"
    ],
    "one_to_many_b": [
      "0091e84e2f9e45af25e360f5e04626f7f7bdcdd07493441980ee352afce53699",
      "00f58f211bb223a45ff886b77150a7d929bec8a52fb150cd4aa233a76a6668b8",
      "0151fe43d12800fa6710619e8b03f9592b61c65101fcd27f495f3f0cb264b518",
      "018c32bd9239472c38a93d506480bd787b57e2cde09bf97742cfd166afed6d73",
      "01f5ffbdf55562fa2f9eb2682ab8a7631beae6f8b7f8383670d7c4db1456631b",
      "021c64cfbbda43a3f2b8d41b1642aab6eb74b3e94fe39fbc7a70f001039251fc",
      "02207b98ad4ae13dc8adf0eb92be3b8e1381043b44c609d57d3865e3b669a13f",
      "022f7c5c3c28e6bd85fbaa7941b10e1a5b0960d87423c8ff52e3ab98995d1d6a",
      "023833d39ba15b4a6a4a407f6a1e1938dab86f3da3d23eed0aa066c60a62c596",
      "0283cd2bf9b6e29a7851c4bedd4600d473961fa4c1f3216f7abd1914e1fe1a07",
      "02b17111bb949a07f11d54db74a393af73b4d999c7e75ea522474219190126b4",
      "02bb92f79df00d5557980a73b80ef0f323d0076a219748c33fb433a6717a33b9",
      "02f5fb8d844c8e751dba127a7ee4b1151a64110db0ee24b369eeacf80b18823f",
      "0307f2ff428d69e343eac173a22f9b370646d32841267792b1461dcb675e5406",
      "030f6af7d17d30f1fafd15e95299ab5739924d0b1ba92cdd57a50d1b9aee926a",
      "03145dd7dc27478ada1e9c19e54629132cf309207b8298f0b6519e39777e2275",
      "0319e7e7414d3c493c6466bcbb1ca466e72f696da72cbb95fcd2f1314e30f5a8",
      "0329d7ddd0c20aed8ba3c11102253e340c3b89356af9b4f6741654fcdd6fc6d8",
      "037e7c400166e879d8ffbada9b39abbdcee4bdefe4c1f1b8cb722b86b6598bd7",
      "03d2112da175b148e161dc40e3fc2555185356e6330138c376557ce0a5b12a51"
    ],
    "truth_dead": [
      "0000872bc8d7bdd8a499ead3657129aeca5b0199c70768b827cf938a49e7a863",
      "000d5e84560945e2a59bb827434b1c40dc924ed8b68f5c255f126c6d371b165e",
      "002fc2f56a87068a0b9d242dfcdc2c709cb979781bf6016fbc20526360e893c9",
      "0032cbf95d79ae40cbb32a675aa6b8c8e18b6e473e7f1575887c48993778a8e2",
      "003bc060b24325d621360a79467e695991a024a2755374221dbf2b63924ba78c",
      "004129c400344bd4eac81f6be80fc574449ff21d68f70ce84b7d5fed2dbb515c",
      "0077b708eeea25ef15bf6ff77170a00f6a20343b88d3928409087a9f43fc75cf",
      "00a783441753c1ed30297ebcbf6fa00b35c0c74cd8b8f5d11ab91552f8ad4f7a",
      "00b52efaa17cce7e23a946e6a26b83d2b8bd1dc5904b6a248451bca83b20fb09",
      "00bb5ccf65123d07c28970dd48bd7d22e02928387c436089bf70d6c2c1c91bad",
      "00e28cd73ee5c056f1ed02df070d3e043e886286e4f4894de3bd6a1dffaa4310",
      "00eed6707cde26369b7cee0593d0fe9217417457875d07633104b5787bab0ecc",
      "00f793b5c84ff9c0fe67327a11623ae9c1e67e2c2095dd4ca59fa8f617acda11",
      "016192a17814d7a7b788235c3db0961132376e6f90e15369057a97525ece52e2",
      "0165148065fd71ead8162ef1f97cb6d0cc38a966043e3ee35b88a21be82fd638",
      "0165ec99c153f68d6329a41bb8ad5361494bd95a4026baf6dda2e6b7719f08ec",
      "0193a1ce57b1a1c262e464ccd05f53789977d3fec857a1a5dabb9d119a3ad3a3",
      "0198f491b1ca87b5bec8498d03c873d0935ce2a2b1779916ba910ef4a32c8dde",
      "01a7ddc596d1ef50dcfd163ca401897cb9648f30ed01a4addb11a133e7a6fcbb",
      "01b1a6205fe83fcac7dd131dfe529f02b42240d20e8f09a7491db32638fade8c"
    ],
    "truth_out_of_scope": [
      "00016470987c8beb48ca38a71733ff4c8b659243bc325ad5eb24d719acc4edd0",
      "0001810a3a36efc78aaaecf4f7bae7bd75ea088945f838a4391773ece8b2e6f6",
      "0002c574b5017d7bfe3b52867e436e599c023abdbc5c9f07ccadcb0b544286da",
      "000337fd7a4e8c2aa9787b13ffa8c57c10108e29b692937ced20569e1eee6f28",
      "00039f55954e02cc045be6b5b61d411997474b291c20e0315ceabf1676ce0352",
      "0003d0220daab5cd3b8e55ef775504a842127328bccd21232013ab73fb775376",
      "00040744c3fc9d7ca50beb8710e2de79e46c1497e8c28a1ac0ccf49e0b433ccd",
      "000569ef919b328257d07a45e76658a682c83a61e993afbf08bd5f0ede59a53c",
      "00058a83bce69d4ece94998220219d57214d2c25abfc08cd9355853f6f02ab43",
      "0005c5cd0030b0a9aff6e015febdcb8fca83c8a299a7a2a0bbbd9171fbfda186",
      "000830ce20a58f944e09913b9505c2a4c88381c2c16c0196131e27e3043972f8",
      "000ad6024e141962ccbf5cf71c830cc345ee0d05378d8f12cf856686bdbb6028",
      "000cdf4c27f270c0f2fab13ea37346882496b271c7e476c55fca1df91925e213",
      "000f76e83657e35ab07f2f0b4e185df4c6b832019f4c71df8d2fed9c885deab9",
      "000fcef93e7eaecf28d367db4f2bcd1043076b5825b703f102810e2e01292858",
      "0010c77b68dfecc111cad7846029439ae79559b8be0b514cdc507c133492c465",
      "0012aab24df49ce8b7a8f4fb60c9249121ccfe52d2c207bfb396e499f4353ba6",
      "0012c54a3d9c573e9896fd676ef0c56af3da9068ebf20f31860920cd1422d25f",
      "0012c69424e4783a446c0aaa9dd50496a4bbdad27661afac0d3eb8002e21b519",
      "0012e57b27d8e9699b58b512bb8c43a29ada98df707108429e903152ac78a17a"
    ],
    "truth_unsampled": []
  },
  "audit_version": "1.0",
  "code_commit": "6b3124b176ea8ffaf198c3ee6aa966cd6a2eccb4",
  "duplicate_links": 0,
  "feature_version": "0.2.0",
  "generated_at_utc": "2026-09-23T14:09:24+00:00",
  "in_sample": {
    "a_records": 241257,
    "b_records": 240930,
    "one_to_many_a": 465,
    "one_to_many_a_rate": 0.001927,
    "one_to_many_b": 792,
    "one_to_many_b_rate": 0.003287,
    "pairs": 241752
  },
  "links_distinct": 349509,
  "links_raw": 349509,
  "scope_primary_type": "Album",
  "truth_dead": 2272,
  "truth_dead_rate": 0.006501,
  "truth_in_sample": 241752,
  "truth_out_of_scope": 105485,
  "truth_out_of_scope_by_primary_type": {
    "Broadcast": 108,
    "EP": 31249,
    "Other": 1216,
    "Single": 71669,
    "none": 1243
  },
  "truth_unsampled": 0
}
